{"account_ref":{"id":"synthetic-account","namespace":"internal_alias"},"available_count":1,"caveats":["Descriptive observation only; no causal inference or lift claimed."],"cohort":"synthetic-cohort","confounders":[],"evidence_refs":[{"context_sha256":"90eb597e07e10af463cf710ded3f1bead574df9cc337c6f849b76a5ff9cb1f92","import_id":"a09-3725875bb6c7123a2321c06f38d66267cd0f48e7bdc1ce2c3673ac72f18c51ef","metric_definition_sha256":"fa3342441748703c6f2847d5c389b27892839b32e32ec8ea5e0a90f55a2d7d88","observation_id":"obs-78a786583835cca3ff992fe379d2d8e4493116354ff1de75bc304e30b4b9a038","observation_sha256":"4ebeff5ce30bbb80699b12c72fa5aa84d76a5b278ed73f78da87cafccb3783fe","raw_sha256":"b51dff06a4c232585873cb3625ab8483dce33cf0013723508494c57f641e4852","snapshot_id":"a11-snapshot-f2bf424c9e94eef36f7a54cf099d79e4fefbec9bf529fc9545f9b045a0ebf68a"}],"inference":"DESCRIPTIVE_ONLY","measurement":{"denominator":null,"numerator":0,"reason":null,"status":"AVAILABLE","unit":"count","value":0},"measurement_window":["2026-10-01T00:00:00+07:00","2026-10-03T00:00:00+07:00"],"metric":{"cohort":"synthetic-cohort","comparison_policy":"NO_CROSS_PROVIDER_EQUIVALENCE","definition":"Synthetic count for an offline example","definition_version":"synthetic-1","denominator":null,"metric_key":"plays","platform":"TIKTOK","provider_name":"Synthetic plays","schema_version":"MetricDefinition.v1","source_status":"USER_SUPPLIED_NOT_LIVE_VERIFIED","unit":"count"},"not_available_count":0,"platform":"TIKTOK","report_id":"a11-report-853268d2ebadc5ecadcc765beda2b55c319f6e788718499fbc6a43a64aab9893","schema_version":"PerformanceReport.v1","snapshot_refs":[{"context_sha256":"90eb597e07e10af463cf710ded3f1bead574df9cc337c6f849b76a5ff9cb1f92","import_id":"a09-3725875bb6c7123a2321c06f38d66267cd0f48e7bdc1ce2c3673ac72f18c51ef","raw_sha256":"b51dff06a4c232585873cb3625ab8483dce33cf0013723508494c57f641e4852","snapshot_id":"a11-snapshot-f2bf424c9e94eef36f7a54cf099d79e4fefbec9bf529fc9545f9b045a0ebf68a"}],"source_status":"USER_SUPPLIED_NOT_LIVE_VERIFIED","surface":"VIDEO","timezone":"UTC+07:00"}