{"account_ref":{"id":"synthetic-account","namespace":"internal_alias"},"available_count":2,"caveats":["Descriptive observation only; no causal inference or lift claimed.","1 of 3 observation(s) NOT_AVAILABLE"],"cohort":"synthetic-cohort","confounders":[],"evidence_refs":[{"context_sha256":"0045c70365e1d3fb8438d7328e5359bd65755265459f0a3668b717cda08f7450","import_id":"a09-9fff3421471d7018517f28d2f7e1d60e433f1b9dcd540858b7d1f171272ba122","metric_definition_sha256":"fa3342441748703c6f2847d5c389b27892839b32e32ec8ea5e0a90f55a2d7d88","observation_id":"obs-7f7e29db1ea82870542b3a79471599a94e0bdae8a15293c851840082d67647a3","observation_sha256":"458952e8a7137bdf18621308a64cc4e16f764477cb4a625cbd9f54f09dc532c3","raw_sha256":"f159f2804935579124acba9684ce4cb910988cb05ce2218ea7ca334c006bb145","snapshot_id":"a11-snapshot-b5333ba04b68a8d2a93ac53b6011e04cc3bb7f4b865f2fb1154e1fd19407829a"},{"context_sha256":"0045c70365e1d3fb8438d7328e5359bd65755265459f0a3668b717cda08f7450","import_id":"a09-9fff3421471d7018517f28d2f7e1d60e433f1b9dcd540858b7d1f171272ba122","metric_definition_sha256":"fa3342441748703c6f2847d5c389b27892839b32e32ec8ea5e0a90f55a2d7d88","observation_id":"obs-21c1394550ae2561f8fc438b490291a0de67fb81a4f54768a86cf9df475df250","observation_sha256":"7661feeb772254ce14b97871a0c49b1257b93c0691f43688ae4a43b5fe87af9a","raw_sha256":"f159f2804935579124acba9684ce4cb910988cb05ce2218ea7ca334c006bb145","snapshot_id":"a11-snapshot-b5333ba04b68a8d2a93ac53b6011e04cc3bb7f4b865f2fb1154e1fd19407829a"},{"context_sha256":"0045c70365e1d3fb8438d7328e5359bd65755265459f0a3668b717cda08f7450","import_id":"a09-9fff3421471d7018517f28d2f7e1d60e433f1b9dcd540858b7d1f171272ba122","metric_definition_sha256":"fa3342441748703c6f2847d5c389b27892839b32e32ec8ea5e0a90f55a2d7d88","observation_id":"obs-d8f15248ab44bb6bed3446f5b00b248c308cbe926d7247b3ded64166dc1a5439","observation_sha256":"dcd309492fa5450f8a40bf293d154fa9dd467a18c126f3003b7456a49c4ce222","raw_sha256":"f159f2804935579124acba9684ce4cb910988cb05ce2218ea7ca334c006bb145","snapshot_id":"a11-snapshot-b5333ba04b68a8d2a93ac53b6011e04cc3bb7f4b865f2fb1154e1fd19407829a"}],"inference":"DESCRIPTIVE_ONLY","measurement":{"denominator":null,"numerator":12,"reason":null,"status":"AVAILABLE","unit":"count","value":12},"measurement_window":["2026-10-03T00:00:00+07:00","2026-10-05T00:00:00+07:00"],"metric":{"cohort":"synthetic-cohort","comparison_policy":"NO_CROSS_PROVIDER_EQUIVALENCE","definition":"Synthetic count for an offline example","definition_version":"synthetic-1","denominator":null,"metric_key":"plays","platform":"TIKTOK","provider_name":"Synthetic plays","schema_version":"MetricDefinition.v1","source_status":"USER_SUPPLIED_NOT_LIVE_VERIFIED","unit":"count"},"not_available_count":1,"platform":"TIKTOK","report_id":"a11-report-843b32f58b0f73f7dfc2a26bc9a9e5caee529d06c323e77034b2425a88ce965c","schema_version":"PerformanceReport.v1","snapshot_refs":[{"context_sha256":"0045c70365e1d3fb8438d7328e5359bd65755265459f0a3668b717cda08f7450","import_id":"a09-9fff3421471d7018517f28d2f7e1d60e433f1b9dcd540858b7d1f171272ba122","raw_sha256":"f159f2804935579124acba9684ce4cb910988cb05ce2218ea7ca334c006bb145","snapshot_id":"a11-snapshot-b5333ba04b68a8d2a93ac53b6011e04cc3bb7f4b865f2fb1154e1fd19407829a"}],"source_status":"USER_SUPPLIED_NOT_LIVE_VERIFIED","surface":"VIDEO","timezone":"UTC+07:00"}