{"account_ref":{"id":"synthetic-account","namespace":"internal_alias"},"available_count":0,"caveats":["Descriptive observation only; no causal inference or lift claimed.","1 of 1 observation(s) NOT_AVAILABLE"],"cohort":"synthetic-cohort","confounders":[],"evidence_refs":[{"context_sha256":"776d94f54ad79dde8173dbc0d12de138a1cb532c19b7ad3d8eeb4c056ca33be0","import_id":"a09-792884790bb665ef24cf0290d6acd2a6c21c1874bedb9f40fef89e6303cecce6","metric_definition_sha256":"fa3342441748703c6f2847d5c389b27892839b32e32ec8ea5e0a90f55a2d7d88","observation_id":"obs-41fd2edcc99c69a3c30ab32f71cb22821a16616a67c614a512a2ed1a4667fc94","observation_sha256":"2f232181fcde8f3916bcac1e31b258901480d8dac7a1dad1923a84067ae7ee9a","raw_sha256":"0ad240ab6c52c3a63d45e7efbb9da54c9c4a23ff6e4029df1795365f8fee4aa2","snapshot_id":"a11-snapshot-31295f14d5e885fa6f385c314ca320c30a9b5e77e2ab97c93d26c9af51bf4804"}],"inference":"DESCRIPTIVE_ONLY","measurement":{"denominator":null,"numerator":null,"reason":"ALL_OBSERVATIONS_NOT_AVAILABLE","status":"NOT_AVAILABLE","unit":"count","value":null},"measurement_window":["2026-10-03T00:00:00+07:00","2026-10-05T00:00:00+07:00"],"metric":{"cohort":"synthetic-cohort","comparison_policy":"NO_CROSS_PROVIDER_EQUIVALENCE","definition":"Synthetic count for an offline example","definition_version":"synthetic-1","denominator":null,"metric_key":"plays","platform":"TIKTOK","provider_name":"Synthetic plays","schema_version":"MetricDefinition.v1","source_status":"USER_SUPPLIED_NOT_LIVE_VERIFIED","unit":"count"},"not_available_count":1,"platform":"TIKTOK","report_id":"a11-report-04b4007f61caba0e84deb9b2914132f21dbfb6df3724592fc3623f6405f5dbc7","schema_version":"PerformanceReport.v1","snapshot_refs":[{"context_sha256":"776d94f54ad79dde8173dbc0d12de138a1cb532c19b7ad3d8eeb4c056ca33be0","import_id":"a09-792884790bb665ef24cf0290d6acd2a6c21c1874bedb9f40fef89e6303cecce6","raw_sha256":"0ad240ab6c52c3a63d45e7efbb9da54c9c4a23ff6e4029df1795365f8fee4aa2","snapshot_id":"a11-snapshot-31295f14d5e885fa6f385c314ca320c30a9b5e77e2ab97c93d26c9af51bf4804"}],"source_status":"USER_SUPPLIED_NOT_LIVE_VERIFIED","surface":"VIDEO","timezone":"UTC+07:00"}